{
  "patient_name": null,
  "patient_dob": null,
  "lab_name": null,
  "lab_phone": null,
  "insurance_provider": null,
  "requesting_doctor": null,
  "technical_manager": null,
  "report_date": null,
  "tests": [
    {
      "test_name": "PESQUISA DE SANGUE OCULTO",
      "material": "Fezes",
      "method": null,
      "collected_at": null,
      "release_at": null,
      "items": [
        { "parameter_name": "Sangue oculto", "result_value": "Negativo", "result_unit": null, "reference_text": null }
      ]
    }
  ]
}
