{
  "patient_name": null,
  "patient_dob": null,
  "lab_name": "LABORATORIO EXEMPLO",
  "lab_phone": null,
  "insurance_provider": null,
  "requesting_doctor": null,
  "technical_manager": null,
  "report_date": "2026-09-01",
  "tests": [
    {
      "test_name": "GLICEMIA DE JEJUM",
      "material": "Soro",
      "method": null,
      "collected_at": "2026-09-01 08:15:00",
      "release_at": null,
      "items": [
        { "parameter_name": "Glicemia de jejum", "result_value": "99", "result_unit": "mg/dL", "reference_text": "70 a 99 mg/dL" }
      ]
    }
  ]
}
